{"$schema":"https://json-schema.org/draft/2020-12/schema","type":"object","required":["identifier","providers","markets"],"properties":{"identifier":{"type":"string","minLength":1},"schema_version":{"type":"string"},"reporting_currency":{"type":"string","pattern":"^[A-Z]{3}$"},"require_complete_candidate_scope":{"type":"boolean"},"providers":{"type":"array","minItems":1,"items":{"type":"object","required":["identifier","provider_name","role","enabled","domains","authoritative_domains","credential_environment_variables","usage_rights_approved","point_in_time_supported","historical_coverage_supported","provenance_complete","service_level_defined","storage_and_backup_approved","derived_analytics_approved","paper_simulation_approved","certification_required"],"additionalProperties":true}},"markets":{"type":"array","minItems":1,"items":{"type":"object","required":["asset_class","state","requirements","rationale"],"additionalProperties":true}}},"additionalProperties":false}
