{
  "identifier": "all-markets-data-supply.development.v2",
  "schema_version": "all-markets-data-manifest.v1",
  "reporting_currency": "USD",
  "require_complete_candidate_scope": true,
  "providers": [
    {
      "identifier": "official-fred",
      "provider_name": "Federal Reserve Economic Data",
      "role": "official",
      "enabled": true,
      "domains": [
        "macro"
      ],
      "authoritative_domains": [
        "macro"
      ],
      "credential_environment_variables": [
        "FRED_API_KEY"
      ],
      "usage_rights_approved": true,
      "point_in_time_supported": true,
      "historical_coverage_supported": true,
      "provenance_complete": true,
      "service_level_defined": true,
      "storage_and_backup_approved": true,
      "derived_analytics_approved": true,
      "paper_simulation_approved": true,
      "certification_required": false,
      "certification_identifier": null,
      "limitations": [
        "FRED supplies official U.S. macroeconomic and rates evidence; revised-vintage backtests require ALFRED-compatible retrieval."
      ]
    },
    {
      "identifier": "official-sec-edgar",
      "provider_name": "SEC EDGAR",
      "role": "official",
      "enabled": true,
      "domains": [
        "security_master",
        "fundamentals",
        "filings"
      ],
      "authoritative_domains": [
        "fundamentals",
        "filings"
      ],
      "credential_environment_variables": [
        "SEC_USER_AGENT"
      ],
      "usage_rights_approved": true,
      "point_in_time_supported": true,
      "historical_coverage_supported": false,
      "provenance_complete": true,
      "service_level_defined": true,
      "storage_and_backup_approved": true,
      "derived_analytics_approved": true,
      "paper_simulation_approved": true,
      "certification_required": false,
      "certification_identifier": null,
      "limitations": [
        "The current SEC ticker feed is not authoritative historical security-master coverage and cannot satisfy that domain by itself.",
        "The current adapter covers recent submissions and company facts; older submission archives must be implemented before SEC alone can satisfy historical filing coverage."
      ]
    },
    {
      "identifier": "official-global-macro",
      "provider_name": "UNASSIGNED_OFFICIAL_GLOBAL_MACRO_PROVIDER",
      "role": "official",
      "enabled": false,
      "domains": [
        "macro",
        "fx_rates",
        "benchmarks"
      ],
      "authoritative_domains": [
        "macro",
        "fx_rates",
        "benchmarks"
      ],
      "credential_environment_variables": [
        "CAPITAL_INTELLIGENCE_GLOBAL_MACRO_PROVIDER"
      ],
      "usage_rights_approved": false,
      "point_in_time_supported": false,
      "historical_coverage_supported": false,
      "provenance_complete": false,
      "service_level_defined": false,
      "storage_and_backup_approved": false,
      "derived_analytics_approved": false,
      "paper_simulation_approved": false,
      "certification_required": true,
      "certification_identifier": null,
      "limitations": [
        "Select and certify IMF, BIS, ECB, World Bank, national central-bank, or licensed equivalent coverage."
      ]
    },
    {
      "identifier": "commercial-global-market-data",
      "provider_name": "UNASSIGNED_GLOBAL_MARKET_DATA_PROVIDER",
      "role": "primary",
      "enabled": false,
      "domains": [
        "market_prices",
        "quotes_liquidity",
        "fx_rates",
        "crypto_market_structure",
        "commodity_curves",
        "benchmarks",
        "derivative_contracts",
        "margin_collateral",
        "volatility_surfaces",
        "execution_inputs"
      ],
      "authoritative_domains": [
        "market_prices",
        "quotes_liquidity",
        "fx_rates",
        "crypto_market_structure",
        "commodity_curves",
        "benchmarks",
        "derivative_contracts",
        "margin_collateral",
        "volatility_surfaces",
        "execution_inputs"
      ],
      "credential_environment_variables": [
        "CAPITAL_INTELLIGENCE_GLOBAL_MARKET_DATA_PROVIDER",
        "CAPITAL_INTELLIGENCE_GLOBAL_MARKET_DATA_API_KEY"
      ],
      "usage_rights_approved": false,
      "point_in_time_supported": false,
      "historical_coverage_supported": false,
      "provenance_complete": false,
      "service_level_defined": false,
      "storage_and_backup_approved": false,
      "derived_analytics_approved": false,
      "paper_simulation_approved": false,
      "certification_required": true,
      "certification_identifier": null,
      "limitations": [
        "Must provide licensed global prices, quotes, liquidity, FX, benchmarks, and realistic paper-execution inputs."
      ]
    },
    {
      "identifier": "commercial-global-reference-data",
      "provider_name": "UNASSIGNED_GLOBAL_REFERENCE_DATA_PROVIDER",
      "role": "primary",
      "enabled": false,
      "domains": [
        "security_master",
        "corporate_actions",
        "market_calendars",
        "benchmarks"
      ],
      "authoritative_domains": [
        "security_master",
        "corporate_actions",
        "market_calendars",
        "benchmarks"
      ],
      "credential_environment_variables": [
        "CAPITAL_INTELLIGENCE_GLOBAL_REFERENCE_DATA_PROVIDER",
        "CAPITAL_INTELLIGENCE_GLOBAL_REFERENCE_DATA_API_KEY"
      ],
      "usage_rights_approved": false,
      "point_in_time_supported": false,
      "historical_coverage_supported": false,
      "provenance_complete": false,
      "service_level_defined": false,
      "storage_and_backup_approved": false,
      "derived_analytics_approved": false,
      "paper_simulation_approved": false,
      "certification_required": true,
      "certification_identifier": null,
      "limitations": [
        "Must preserve historical identifiers, listings, delistings, corporate actions, calendars, and survivorship-safe universe coverage."
      ]
    },
    {
      "identifier": "commercial-global-fundamentals",
      "provider_name": "UNASSIGNED_GLOBAL_FUNDAMENTALS_PROVIDER",
      "role": "primary",
      "enabled": false,
      "domains": [
        "fundamentals",
        "filings"
      ],
      "authoritative_domains": [
        "fundamentals",
        "filings"
      ],
      "credential_environment_variables": [
        "CAPITAL_INTELLIGENCE_GLOBAL_FUNDAMENTALS_PROVIDER",
        "CAPITAL_INTELLIGENCE_GLOBAL_FUNDAMENTALS_API_KEY"
      ],
      "usage_rights_approved": false,
      "point_in_time_supported": false,
      "historical_coverage_supported": false,
      "provenance_complete": false,
      "service_level_defined": false,
      "storage_and_backup_approved": false,
      "derived_analytics_approved": false,
      "paper_simulation_approved": false,
      "certification_required": true,
      "certification_identifier": null,
      "limitations": [
        "Must normalize global accounting standards while retaining filing acceptance and revision boundaries."
      ]
    },
    {
      "identifier": "commercial-fixed-income-data",
      "provider_name": "UNASSIGNED_FIXED_INCOME_DATA_PROVIDER",
      "role": "primary",
      "enabled": false,
      "domains": [
        "security_master",
        "market_prices",
        "quotes_liquidity",
        "fixed_income_terms",
        "market_calendars",
        "benchmarks",
        "execution_inputs"
      ],
      "authoritative_domains": [
        "security_master",
        "market_prices",
        "quotes_liquidity",
        "fixed_income_terms",
        "market_calendars",
        "benchmarks",
        "execution_inputs"
      ],
      "credential_environment_variables": [
        "CAPITAL_INTELLIGENCE_FIXED_INCOME_DATA_PROVIDER",
        "CAPITAL_INTELLIGENCE_FIXED_INCOME_DATA_API_KEY"
      ],
      "usage_rights_approved": false,
      "point_in_time_supported": false,
      "historical_coverage_supported": false,
      "provenance_complete": false,
      "service_level_defined": false,
      "storage_and_backup_approved": false,
      "derived_analytics_approved": false,
      "paper_simulation_approved": false,
      "certification_required": true,
      "certification_identifier": null,
      "limitations": [
        "Must supply instrument terms, clean and dirty prices, accrued interest, yields, duration, ratings, calls, defaults, and liquidity."
      ]
    },
    {
      "identifier": "commercial-crypto-validation-data",
      "provider_name": "UNASSIGNED_CRYPTO_VALIDATION_PROVIDER",
      "role": "validation",
      "enabled": false,
      "domains": [
        "security_master",
        "market_prices",
        "quotes_liquidity",
        "crypto_market_structure"
      ],
      "authoritative_domains": [
        "security_master",
        "market_prices",
        "quotes_liquidity",
        "crypto_market_structure"
      ],
      "credential_environment_variables": [
        "CAPITAL_INTELLIGENCE_CRYPTO_VALIDATION_PROVIDER",
        "CAPITAL_INTELLIGENCE_CRYPTO_VALIDATION_API_KEY"
      ],
      "usage_rights_approved": false,
      "point_in_time_supported": false,
      "historical_coverage_supported": false,
      "provenance_complete": false,
      "service_level_defined": false,
      "storage_and_backup_approved": false,
      "derived_analytics_approved": false,
      "paper_simulation_approved": false,
      "certification_required": true,
      "certification_identifier": null,
      "limitations": [
        "Independent multi-venue validation is required so one exchange is not treated as the complete crypto market."
      ]
    },
    {
      "identifier": "eodhd-primary",
      "provider_name": "EODHD broad multi-asset evidence",
      "role": "primary",
      "enabled": false,
      "domains": [
        "security_master",
        "market_prices",
        "corporate_actions",
        "fundamentals",
        "fx_rates",
        "fixed_income_terms",
        "commodity_curves",